words,lenword_count
还别人钱还买礼物吗,1.0
还没追到能送贵重礼物吗,1.0
追求你的人礼物都不送,1.0
送40女领导礼物排行榜,1.0
送40男领导礼物排行榜,1.0
送4周岁男宝宝礼物,1.0
送50男领导礼物排行榜,1.0
送一个不可能的人礼物,1.0
送一个人礼物他不说谢谢,1.0
送一个男的礼物送什么,4.0
送一岁男宝宝礼物推荐,1.0
送不抽烟的男客户礼物,1.0
送两岁男宝宝礼物推荐,1.0
送中国礼物英语作文,1.0
送什么礼物给不抽烟不喝酒的长辈,1.0
送你的礼物400字作文400字,2.0
送初中女儿礼物排行榜,1.0
送初中妹妹礼物排行榜,1.0
送别人宝宝周岁礼物,1.0
送别人的礼物不收,3.0
送别人礼物不收,1.0
送别人礼物的作文400字,1.0
送去美国好友的礼物,1.0
送同事女儿生日礼物多少钱合适,1.0
送同事礼物还被说,1.0
送同学的自制礼物diy,1.0
送同学礼物送台湾的小吃在哪里买,1.0
送员工什么生日礼物送员工礼,6.0
送周岁女宝宝礼物,7.0
送周岁女宝宝礼物好,1.0
送女儿18岁礼物送什么,4.0
送女孩一个礼物女孩不要怎么办,1.0
送女孩创意礼物排行榜,1.0
送女孩子礼物不收,1.0
送女孩子礼物写贺卡,1.0
送女孩小礼物后说还我钱,1.0
送女孩礼物不收,4.0
送女孩礼物不收怎么办,1.0
送女孩礼物女孩接受表示什么,1.0
送女孩礼物她收了说我吃饱撑的,1.0
送女孩礼物她说下次不要再送了,1.0
送女孩礼物她说浪费钱,1.0
送女孩礼物她说谢谢,1.0
送女孩礼物接受了谢谢,1.0
送女孩礼物说浪费钱,1.0
送女孩礼物连句谢谢都没有,1.0
送女方父母礼物不收,1.0
送妹妹生日礼物送什么礼物好,10.0
送妹妹礼物贺卡上面写,1.0
送妹妹礼物贺卡怎么写,1.0
送婆婆母亲节礼物推荐,1.0
送婆婆礼物说的感谢话,1.0
送宝宝特别的周岁礼物,1.0
送客户礼物贺卡怎么写,1.0
送对象妹妹礼物送什么,2.0
送小朋友小朋友礼物排行榜,1.0
送幼儿园大班小朋友什么礼物好,1.0
送日本人什么中国礼物,1.0
送日本人礼物写什么话,1.0
送日本人礼物如何包装,1.0
送日本人礼物时怎么说,1.0
送日本人礼物是怎么说,3.0
送日本人礼物送什么好,5.0
送母亲礼物作文800字,1.0
送母亲节礼物作文400字,1.0
送爸爸的礼物英语作文,2.0
送特别牛逼的人送什么礼物,1.0
送男初中同学生日礼物,1.0
送男客户礼物排行榜,1.0
送男客户礼物送什么最好,1.0
送男情人生日礼物送鞋子,1.0
送男的不贵重礼物,1.0
送男的分手礼物送什么,2.0
送男闺蜜什么礼物好学生,1.0
送男闺蜜有纪念意义的礼物,1.0
送男闺蜜生日礼物实用,1.0
送男闺蜜礼物什么最有纪念意义,1.0
送男闺蜜礼物意义,3.0
送男领导创意礼物,1.0
送男领导女儿礼物,1.0
送男领导实用礼物,1.0
送男领导的礼物排行榜,38.0
送男领导礼物排行榜,5.0
送男领导过年礼物,1.0
送相亲女礼物后,1.0
送相亲女礼物被拒绝了,1.0
送相亲女贵重礼物要回,1.0
送相亲对象女生日礼物,1.0
送礼物谢谢都不说,1.0
送给幼儿园大班的自制礼物,1.0
送给情人不被老婆发现的礼物,1.0
送给我的礼物英语句子怎么写,1.0
送给母亲礼物作文200字,1.0
送给母亲礼物应该送哪样的礼物,1.0
送给父母的礼物英文怎么说,1.0
送给父母的礼物英语作文,1.0
送给爸爸的新年礼物读后感500字,1.0
送给爸爸的礼物用英语怎么说,1.0
送给爸爸的礼物英语作文,1.0
送给老人礼物写四个字,1.0
送给长辈的礼物作文1000字,1.0
送美国人什么中国中国礼物好,1.0
送美国人什么中国礼物,22.0
送美国人礼物带价签,1.0
送老人礼物英语作文,1.0
送老人适合送什么礼物,1.0
送老婆什么礼物老婆会激动惊喜,1.0
送老婆实用礼物图片,1.0
送老婆实用礼物推荐,1.0
送老婆的创意礼物排行榜,1.0
送老婆的生日礼物里面想写句话,1.0
送老婆礼物发朋友圈,1.0
送老婆礼物贺卡怎么写,1.0
送自己一份礼物英文怎么说,1.0
送金牛女礼物她不接受,1.0
送金牛女礼物她说谢谢,1.0
送金牛女礼物送钱,1.0
送长辈女领导礼物,2.0
送长辈女领导礼物好,1.0
送闺蜜女儿礼物排行榜,1.0
送闺蜜礼物贺卡写什么,2.0
送闺蜜礼物贺卡写什么好,1.0
送闺蜜礼物贺卡怎么做,1.0
送闺蜜礼物贺卡怎么写,1.0
送领导的小孩礼物过年,3.0
送领导礼物不收怎么说,1.0
送领导礼物写贺卡,1.0
送领导礼物太贵重不收,1.0
送领导礼物贺卡怎么写,1.0
送领导送什么礼物日本,5.0
适合女宝宝的周岁礼物,1.0
适合送50岁左右女领导的礼物,1.0
适合送幼儿园小朋友的礼物,10.0
适合送情侣的特别的礼物,1.0
适合送男闺蜜的生日礼物,1.0
适合送男领导的礼物,1.0
适合送长辈的礼物图片,1.0
适合送领导儿子的礼物,1.0
那手机表白拒绝了还收礼物,1.0
金星说情人节不送礼物的男人,1.0
金牛女不接受贵重礼物,1.0
金牛座女孩会随便收人礼物吗,1.0
长辈女的过生日送什么礼物,4.0
长辈女的过生日送什么礼物好,1.0
长辈过生日送什么礼物最好40岁女,1.0
闺蜜学生过生日送什么礼物,2.0
闺蜜学生过生日送什么礼物好,1.0
闺蜜过生日送什么礼物好实用,1.0
闺蜜送我礼物感谢她说说,1.0
闺蜜送的礼物发表说说,1.0
阿英第一次直播刷了多少钱礼物,1.0
领导发礼物说什么感谢,1.0
领导送员工礼物拒绝么,1.0
