words,lenword_count
18岁男孩成年家长送什么礼物好,1.0
2周岁女宝宝生日礼物,1.0
2岁女宝宝过生日送什么礼物,1.0
2岁女宝宝过生日送什么礼物好,1.0
35岁女领导过生日送什么礼物好,1.0
cf礼物盒没怎么送战队人,1.0
diy创意自制礼物图片,2.0
diy创意自制礼物图片大全,1.0
diy礼物送闺蜜怎么做,1.0
lol怎么重新看别人送的礼物,1.0
lol赠送礼物已接受好友,1.0
qq上别人送的礼物在哪,2.0
qq上别人送的礼物在哪里看,1.0
qq上怎么给好友发礼物,1.0
qq别人送的礼物去哪了,1.0
qq别人送的礼物怎么看,4.0
qq好友会不会拒绝自己的礼物,1.0
qq怎么看别人送的礼物,3.0
qq怎么看礼物送没送,1.0
qq手机怎么送好友礼物,6.0
qq直播礼物多少钱一个,1.0
qq直播送的礼物多少钱,1.0
qq直播送的礼物怎么看,1.0
qq直播里的礼物多少钱,2.0
qq空间赠送礼物时不显示礼物列表,1.0
qq表情生日礼物qq图片生日礼物,1.0
qq赠送礼物不能送给非好友吗,1.0
qq送给女朋友生日礼物她回赠谢谢,1.0
qq里怎么样送好友礼物,1.0
qq里怎么赠送好友礼物,1.0
steam别人送的礼物在哪里看,1.0
steam好友送的礼物怎么接受,1.0
steam接受礼物后就没了,1.0
steam礼物不接受会怎样,1.0
yy七夕活动2013刷礼物活动,1.0
yy上直播的礼物怎么看,1.0
yy主播直播礼物排名怎么看,1.0
yy免费礼物咋刷给主播,1.0
yy免费礼物能兑换钱吗,1.0
yy刷礼物主播能分多少钱,1.0
yy刷礼物的都是什么人,1.0
yy感谢刷礼物的句子,1.0
yy手机直播会不会刷礼物,1.0
yy游戏直播礼物大宝剑多少钱一个,1.0
yy直播在哪看送的礼物,1.0
yy直播礼物多少钱一个,2.0
yy直播送的礼物多少钱,1.0
yy给主播刷礼物他们怎么得钱的,1.0
yy里送主播都有什么礼物,1.0
一个5岁的女孩生日送什么礼物,1.0
一个女人主动向一个男的要礼物,1.0
一个女孩有对象还接受我的礼物,1.0
一个男人结婚七年没送过一份礼物,1.0
一个男的过生日送什么礼物,3.0
一个男的过生日送什么礼物好,1.0
一个礼物换回一个礼物阅读答案,2.0
一个礼物换回另一个礼物阅读,2.0
一个礼物换回另一个礼物阅读答案,1.0
一个笑脸一个礼物一个狗一个衣服,2.0
一个节日礼物英文怎么说,1.0
一个难忘的礼物英文作文100字,1.0
一份爱的礼物800字作文,1.0
一份特别的礼物600字,1.0
一份特别的礼物作文400字,2.0
一份特别的礼物作文400字以上,1.0
七夕情人节礼物送男,3.0
七夕情人节送老婆礼物,1.0
七夕给刚认识2个礼拜的女孩送什么礼物好,1.0
上初中的女孩买什么礼物,1.0
不抽烟不喝酒的领导送什么礼物,1.0
不收礼物的女情人,2.0
不收礼物的女情人好吗,1.0
不收红包不收礼物,1.0
中国人接受接受日本礼物馈赠,1.0
中国人接受礼物的图片,1.0
中国送女人礼物品牌排行榜,1.0
为什么会有人给yy主播刷礼物,1.0
为什么分手后还留着我送她的礼物,1.0
为妹妹做生日礼物自制的用纸做,1.0
主播刷深渊让人刷礼物,1.0
买一份礼物的英语怎么说,1.0
买一本书送给我十八岁的女儿做成人礼物,1.0
买礼物不一定要买贵的英文,1.0
买礼物连句谢谢都不说,1.0
买礼物送长辈买什么好,1.0
五十岁男领导生日送啥礼物,1.0
他从盒子里拿出了一份礼物的英文,1.0
他是我生命中的礼物写800字作文,1.0
以用心做一个礼物送给父母为题目,1.0
作文和同学离别送给同学的礼物,1.0
作文我有一份礼物送给你一千字,1.0
作文我送别人的礼物1OO字,1.0
作文父亲节送爸爸礼物,1.0
你会为未见面的情人买礼物吗,1.0
你可以自己做一个礼物送给她英语,1.0
你想为他买一个什么礼物的英语,1.0
俩人过生日女的送男的啥礼物,1.0
做一份特别的礼物英语,2.0
做礼物包装图片的视频,1.0
儿子的后穴当父亲节礼物全文阅读,1.0
儿子的礼物中怎么评价一个人,1.0
儿子送妈妈的生日礼物咋回复儿子,1.0
儿童折纸视频礼物盒,2.0
免费给主播刷礼物yy,1.0
兔礼物的活动怎么做没看懂,1.0
公司办年会三千多适合买什么礼物,1.0
公司活动互换礼物最有创意的礼物,1.0
公司生日会礼物送什么礼物给员工好,1.0
公司给女员工发礼物,1.0
公司送员工母亲节礼物,2.0
公司送员工母亲节礼物好,1.0
公司送员工礼物送什么,11.0
公司送员工节日礼物实用推荐,1.0
六一礼物教案反思小班,1.0
内向的女人拒绝表白后又收礼物,1.0
写一封我想要的礼物的作文给家长,1.0
写别人送我礼物的作文400字,1.0
写母亲节的礼物作文400字,1.0
写给送我生日礼物的人说说,1.0
写送礼物的作文写300个字,1.0
分手了还会接受礼物吗,2.0
分手了还送不送礼物,1.0
分手后他收了我送的生日礼物,1.0
分手后他答应的分手礼物一直不给,1.0
分手后借给她的钱与送的礼物,1.0
分手后情人把我送的礼物都归还了,1.0
分手后想挽回送什么礼物,1.0
分手后的女情人要礼物,1.0
分手后给她送礼物不收,1.0
分手后贵重礼物收吗,1.0
分手后还接受礼物,9.0
分手后还收生日礼物,1.0
分手后还能接受他送的礼物吗,1.0
分手后还能收对方的礼物吗,1.0
分手后还送我礼物,4.0
分手后还送生日礼物吗,2.0
分手后送他礼物一句感谢都没有,1.0
分手后送出的贵重礼物,1.0
分手礼物送男生分手礼物什么好,1.0
刚见面送女孩贵重礼物,1.0
创意生日礼物送爸爸diy,1.0
初中儿子过生日送啥礼物,1.0
初中学生母亲节礼物送什么好,1.0
初次见相亲对象送什么礼物合适呢,1.0
别人不收礼物怎么说,1.0
别人在淘宝上买的礼物如何知道是谁买的,1.0
别人送你礼物但是不跟你说是什么,1.0
别人送宝宝礼物的说说,1.0
别人送新年礼物会多想吗,1.0
别人送的礼物送别人,8.0
别人送礼物给你你不要还说不好看,1.0
别人送给你的礼物说说,1.0
刷礼物把主播刷哭视频,1.0
办公室女领导适合送什么小礼物,1.0
去别人新家一般都带什么礼物,1.0
去大市场买同学录和毕业礼物作文,1.0
去女孩家相亲问他什么礼物,1.0
去旅游没给同事带礼物,1.0
去日本买什么礼物送给上司,1.0
去日本买什么礼物送给女孩好,1.0
去日本买礼物送女领导,1.0
去日本买礼物送家人,1.0
去日本买礼物送领导,2.0
去日本人家里做客买什么礼物,1.0
去日本可以给爸爸买什么礼物好,1.0
去日本女孩买什么礼物,2.0
去日本女孩买什么礼物好,1.0
去日本旅游给小孩带什么礼物,1.0
去日本旅游给小孩带什么礼物好,1.0
去日本给同事带什么礼物,1.0
去日本给同事带什么礼物好,1.0
去日本给小朋友带礼物,1.0
去日本给小朋友带礼物好,1.0
去日本给父母带什么礼物,1.0
去日本给父母带礼物,2.0
去日本给爸爸买礼物,2.0
去日本给爸爸买礼物好,2.0
去日本给爸爸带什么礼物,1.0
去日本给爸爸带什么礼物好,1.0
去日本给老人带的礼物,1.0
去日本给老人带的礼物好,1.0
去日本给老婆买啥礼物,1.0
去日本送同学什么礼物,2.0
去日本送同学什么礼物好,1.0
去朋友家看宝宝买什么礼物,1.0
去看小朋友带什么礼物好,1.0
去看男班主任带啥礼物,1.0
去看老人送什么礼物好,1.0
去礼物店包装下礼物,1.0
去美国买什么礼物最好带回来,1.0
去美国可以带的礼物给中国人,1.0
去美国旅游给领导带什么礼物,1.0
去美国旅游给领导带什么礼物好,1.0
去美国给小朋友带礼物,1.0
去美国给父亲买什么礼物,1.0
去见客户带什么礼物好,1.0
去见家长送什么礼物好,2.0
去超市买新年礼物作文250字,1.0
去送日本人什么礼物好,1.0
去韩国买什么礼物送朋友圈,1.0
去韩国带礼物送给小孩,1.0
双方家长第一次见面要送什么礼物,1.0
同事过生日送不送礼物,1.0
同学去美国送什么礼物,1.0
同学生日没请自己吃饭还送礼物吗,1.0
同学老婆过生日送什么礼物,2.0
同学老婆过生日送什么礼物好,1.0
同学赠送礼物感谢同学,1.0
同学过生日没送礼物该说什么,1.0
同学过生日送什么礼物好简单实用,1.0
周岁女宝宝送什么礼物,2.0
哇塞软件别人送的礼物可以兑换钱,1.0
唯品会买护肤品会送小礼物吗,1.0
回家没给父亲买礼物父亲不高兴,1.0
回湖南过年买什么礼物送长辈,1.0
圣诞生日该不该相亲对象买礼物,1.0
圣诞节可以两个人一起去买礼物吗,1.0
圣诞节搞活动买什么礼物给小朋友,1.0
圣诞节礼物是平安夜送还是圣诞节送,1.0
圣诞节礼物送同事礼物,1.0
圣诞节自己做的创意礼物图片,1.0
圣诞节送什么礼物给宝宝同学,1.0
圣诞节送什么礼物给幼儿园小朋友,1.0
圣诞节送女生什么礼物好个性礼物定制,1.0
圣诞节送小孩多少钱礼物好,1.0
圣诞节送幼儿园小朋友礼物,2.0
圣诞节送相亲女什么礼物,4.0
在qq上怎么送好友礼物,3.0
在手机上怎么查看qq好友送的礼物,1.0
在日本买什么小礼物送小朋友,1.0
处女座女把送的礼物拍照发朋友圈,1.0
处女男过年会送对方父母礼物,1.0
处对象白天女孩送男孩什么礼物,1.0
大姐送妹妹礼物说说,1.0
大班分级阅读特别的礼物教案,1.0
大班教案买礼物反思,1.0
大班数学活动教案送礼物活动反思,1.0
大班爱的礼物活动反思,1.0
天秤男人从不给你买礼物是不爱吗,1.0
天蝎男分手后还送我礼物什么意思,1.0
天蝎男接受我的礼物后不回我信息,1.0
女下属送男领导的生日礼物,2.0
女下属送给男领导的礼物,1.0
女人想要礼物那条说说,1.0
女儿28岁的的生日爸爸送什么礼物,1.0
女儿不想要父母的礼物,1.0
女儿母亲节礼物说说,2.0
女儿第一次上班送领导什么礼物好,1.0
女儿送母亲母亲节礼物,2.0
女儿送母亲节礼物说说,1.0
女儿送爸爸的礼物实用,1.0
女儿送爸爸礼物折纸,1.0
女儿送爸爸礼物排行榜,1.0
女可以给男领导送生日礼物吗,1.0
女同事收我贵重礼物后怎么说自己压力大呀,1.0
女孩18岁送什么特别的礼物,1.0
女孩不回信但还收礼物,1.0
女孩不接受情人节礼物,1.0
女孩不适合收的礼物,1.0
女孩拒绝收男孩礼物,1.0
女孩接受礼物说谢谢,1.0
女孩收了礼物又说不合适,1.0
女孩收礼物后不回信息,1.0
女孩见家长买什么礼物,1.0
女孩说很感谢我送的生曰礼物,1.0
女孩说谢谢送的礼物,1.0
女孩送男孩礼物意义,3.0
女孩送男孩礼物的意义,3.0
女孩送闺蜜礼物排行榜,1.0
女宝宝周岁送什么礼物,1.0
女客户过生日送啥礼物好,1.0
女情人该送什么礼物给男情人,1.0
女情人过生日送什么礼物最好,1.0
女方去见男方家长带啥礼物,1.0
女方第一次见男方家长送什么礼物,6.0
女生日记中情人节冉东阳买礼物是第几集,1.0
女的送男的礼物排行榜,1.0
女领导过生日送什么礼物好,2.0
女领导过生日送什么礼物好呢,1.0
女领导过生日送什么花礼物,1.0
女领导过生日送啥礼物,1.0
她们都会送我礼物英文,1.0
如何制作一个有意义的生日礼物给母亲,1.0
如何在手机qq上删除qq空间礼物,1.0
如果分手后想复合送什么礼物,1.0
妹妹去美国读书送什么礼物,1.0
妹妹生了小孩给小孩买什么礼物好,1.0
姐姐结婚送她小孩子的衣服做礼物好不好,1.0
姐姐送毕业礼物给妹妹,1.0
姐姐送给我的礼物作文350字,1.0
婆婆过生日送什么礼物好要实用的,1.0
婆婆送儿媳妇礼物说说,1.0
婚外情人不给我钱总是买礼物,1.0
学生见家长买什么礼物,1.0
学生送多少钱的礼物算贵重,1.0
宝宝2周岁送什么礼物好,2.0
宝宝周岁爸爸送什么礼物好,1.0
宝宝满周岁爸爸送什么礼物,1.0
宝宝过生日婆婆没礼物,1.0
客户儿子16岁生日送什么礼物好,1.0
家长买礼物去班主任家怎么说,1.0
家长去幼儿园送圣诞礼物炫耀,1.0
对象父亲过生日送什么礼物,1.0
射手男情人节一般会送什么礼物,1.0
小学四年级男孩过生日送什么礼物,1.0
小学生4年级圣诞节的礼物的作文200字,1.0
小学生作文别人送给我的礼物,1.0
小学生作文送给同学的礼物,1.0
小学生作文送给爸爸的礼物,2.0
小学生我爱母亲送礼物作文,1.0
小学生毕业送什么礼物给同学,1.0
小孩上初中送什么礼物好,1.0
小孩上小学送什么礼物,2.0
小孩周岁父母送什么礼物,1.0
小朋友上幼儿园送什么礼物,1.0
小班教案反思爱的礼物,3.0
已婚情人不陪我不买礼物给我,1.0
带过生日的人去挑礼物,1.0
幼儿园diy礼物盒图片,2.0
幼儿园diy礼物盒图片大全,1.0
幼儿园小朋友过生日送什么礼物,2.0
幼儿园小朋友过生日送什么礼物好,1.0
幼儿园小朋友送教师节礼物,1.0
幼儿园小班儿童节的礼物教案,1.0
微商过年做活动送什么礼物,1.0
快手刷的礼物都多少钱,1.0
快手手机上怎么刷礼物,1.0
快手直播刷礼物图片,2.0
快手直播王者荣耀怎么看观众送的礼物,1.0
快手直播礼物都多少钱,1.0
快过年了给爱的人送什么礼物好,1.0
怎么在手机上看qq礼物,1.0
怎么看别人送的qq礼物,4.0
情人什么礼物都不送,1.0
情人分手了还接受礼物,1.0
情人分手后还收礼物,1.0
情人的礼物收还是不收,1.0
情人第一次见面送什么礼物,1.0
情人节一般男的都送啥礼物,1.0
情人节不给老婆买礼物,1.0
情人节到底买不买礼物,1.0
情人节女的要送男的礼物吗,1.0
情人节女的还需要送男的礼物,1.0
情人节想要礼物的说说,1.0
情人节晒礼物有种晒对象的说说,1.0
情人节没人送礼物图片,1.0
情人节没人送礼物的句子,1.0
情人节没人送礼物说说,1.0
情人节没礼物什么话也不说,1.0
情人节没礼物的说说,1.0
情人节没礼物说说,3.0
情人节没送礼物给女情人说明什么,1.0
情人节男情人会送你礼物吗,1.0
情人节送女孩什么礼物图片,2.0
情人节送女孩什么礼物图片大全,1.0
情人节送女孩什么礼物最有意义,1.0
情人节送女孩礼物意义,2.0
情人节送女孩礼物说什么朴实,1.0
情人节送相亲女什么礼物,1.0
情人节送相亲对象礼物,1.0
情人节送相亲男什么礼物,1.0
情人节送相亲男礼物,3.0
情人节送老婆什么礼物最有意义,1.0
情人节领导送员工什么礼物好,1.0
情人过生日送什么礼物最有意义,1.0
情人送的礼物感谢句子,1.0
情人送给老婆一个礼物,2.0
情人送给老婆一个礼物好,1.0
情侣100天纪念日适合送什么礼物,1.0
情侣之间每个节日都会送礼物吗,1.0
情侣送什么礼物会分手,1.0
想拒绝别人礼物的说说,1.0
想给闺蜜制作一个礼物什么好,1.0
想给闺蜜送份生日礼物不知道送什么好呢,1.0
感谢别人介绍工作送钱还是送礼物,1.0
感谢同事给她一个小礼物怎么说,1.0
感谢同学送礼物的说说,1.0
感谢女儿送礼物的说说,1.0
感谢父母送的礼物说说,1.0
感谢男领导送什么礼物,1.0
感谢送我礼物的人句子,1.0
感谢闺蜜送礼物的说说,1.0
感谢领导收我送的礼物怎么表达,1.0
我和父母一起买礼物用英语怎么说,1.0
我和男情人见面要送什么礼物,1.0
我想要一份礼物作文350字,1.0
我想要情人节礼物英语怎么说,1.0
我是男的一个女同事过生日送什么礼物,1.0
我是男的给领导老婆送什么礼物好,1.0
我最心爱的礼物三百字作文以上男生作文,1.0
我送女孩礼物她没拒绝,1.0
手机qq上怎么送好友礼物,1.0
手机qq免费礼物怎么送,1.0
手机qq别人送的礼物,3.0
手机qq好友生日取消送出的礼物,1.0
手机qq好友送的礼物,11.0
手机qq怎么看别人送的礼物,2.0
手机qq怎么送好友礼物,4.0
手机qq空间怎么送好友礼物,1.0
手机qq能送好友礼物吗,1.0
手机上qq怎么给好友发礼物,1.0
手机上yy刷礼物时提醒怎么弄出来,1.0
手机怎么送qq好友礼物,5.0
手机虎牙直播免费礼物,1.0
把礼物送给别人英语怎么说,1.0
折纸做爸爸礼物贺卡,1.0
折纸做礼物盒怎么做,2.0
接受礼物时中国人一般会拒绝,1.0
搞笑说说带图片要礼物,1.0
收了客户的礼物书说说,1.0
斗鱼别人送的礼物在哪里看,1.0
斗鱼直播主播礼物排行榜,1.0
斗鱼直播别人送的礼物,1.0
新年到了要送同学礼物的英语作文,1.0
日本买什么礼物送老人,1.0
日本买什么礼物送领导,1.0
日本人本命年送啥礼物,1.0
日本送小孩的礼物推荐,1.0
日本适合给两岁小孩带的礼物,1.0
日本适合送父母的礼物,1.0
日本适合送老人的礼物,1.0
日记母亲节给母亲一份特别的礼物,1.0
明星去机场都会有粉丝送礼物吗,1.0
晒闺蜜送的礼物说说,1.0
最适合送男闺蜜的礼物,1.0
最适合送男领导的礼物,1.0
梦见买了礼物去见舅舅买了香烟,1.0
梦见别人买礼物送自己,1.0
梦见别人给钱买礼物给过世的人,1.0
梦见小孩给母亲买礼物,1.0
梦见情人送别人礼物,1.0
梦见拿礼物去看人,1.0
母亲感谢儿子送生日礼物的话,1.0
母亲节特别的礼物作文400字,1.0
母亲节特别礼物作文400字,2.0
母亲节的礼物400字作文400字,17.0
母亲节送的礼物画的画,2.0
母亲节都要婆婆送什么礼物,1.0
母亲节都送婆婆礼物吗,1.0
毕业送给同学的礼物不用钱的,1.0
没正式见女方家长过年捎礼物,1.0
没礼物的情人节说说,3.0
没给情人买礼物该咱说,1.0
没钱还看直播刷礼物,1.0
湖北人妹妹结婚要给嫂子买礼物吗,1.0
炫舞别人送的节日礼物盒在哪,1.0
爱健身爱徒步的女孩送什么礼物好,1.0
爱拍中怎么送免费的礼物,1.0
爱的礼物小班活动反思,1.0
父亲节创意礼物贺卡图片,1.0
父亲节给父亲做礼物英语作文,1.0
父亲节送父亲礼物排行榜,3.0
父亲节送爸爸礼物作文,2.0
父亲节适合小学生送的礼物,1.0
父亲过生日女儿送什么礼物,2.0
父亲过生日女儿送什么礼物好,1.0
父亲送18岁闺女圣诞礼物推荐,1.0
父亲送儿子18岁生曰礼物,1.0
父母离婚父亲看女儿的礼物,1.0
父母送18岁礼物排行榜,1.0
父母送一岁宝宝什么生日礼物最有意义呢,1.0
父母送儿子18岁成人礼物,1.0
父母送女儿18岁成人礼礼物,1.0
爸爸去北京买礼物给我作文,1.0
爸爸本命年女儿送什么礼物好,1.0
爸爸的父亲节礼物作文350字,1.0
爸爸送我的礼物写一篇作文,1.0
特别想要礼物的说说,1.0
特别的礼物600字初中,3.0
狮子男分手还送我礼物,1.0
班里同学送室友礼物而没送你,1.0
用手机怎样设置不收好友的礼物,1.0
用老婆的钱给老婆买礼物,1.0
男下属给女领导买礼物,1.0
男人过生日送什么礼物最有纪念意义,1.0
男士在朋友圈晒女孩送的礼物,1.0
男士领导过生日送什么礼物好,1.0
男孩为什么会送女孩礼物,1.0
男孩想女孩可以送一份礼物,1.0
男孩过生日送什么礼物最适合,1.0
男孩送女孩礼物的意义,2.0
男孩送礼物给女孩不收,1.0
男宝宝周岁送什么礼物好,1.0
男情人不给你买礼物,1.0
男情人拒绝收我的礼物,1.0
男情人生病了带啥礼物去看,1.0
男情人过生日送什么礼物,2.0
男情人过生日送什么礼物最好,1.0
男情人过生日送多少钱的礼物,1.0
男的不接受女的礼物,1.0
男的不给女的买礼物,2.0
男的不给女的买礼物好,1.0
男的同事过生日送什么礼物好,1.0
男的给女的过生日买什么礼物合适,1.0
男的说送你礼物女的说下次,1.0
男的过生日男的送什么礼物,16.0
男领导给女下属带礼物,1.0
男领导过生日送什么礼物好,1.0
男领导送给女员工的新年小礼物,1.0
画副画送给外婆做生日礼物,1.0
直播刷礼物多少钱一个,1.0
直播里刷礼物的都是托,1.0
相亲后见面买什么礼物,1.0
相亲女不愿意接受你礼物,1.0
相亲女几次不接受礼物,1.0
相亲女父母不收礼物,1.0
相亲对象追你但不送你生日礼物,1.0
相亲对象送情侣礼物,1.0
相亲带什么礼物见家长,1.0
相亲男情人节不送礼物,1.0
相亲男没送我生日礼物,1.0
相亲男没送过我礼物,1.0
相亲第一次见面送什么礼物,1.0
相亲见家长带什么礼物,1.0
相亲送的礼物想要回来怎么说,1.0
看产妇不送礼物只送钱,1.0
看同事小孩送什么礼物,1.0
看同事小孩送什么礼物好,1.0
看直播刷礼物的人,1.0
礼物作文550字(别人送我),1.0
礼物盒diy包装图片,1.0
礼物盒一个装一个盒子一层一层开,1.0
礼物盒的包装的英文怎么说,1.0
第一次去儿子干妈家该送什么礼物,1.0
第一次去别人家吃饭带什么礼物好,1.0
第一次去女方家过年带什么礼物,2.0
第一次去对象家对象不让买礼物,1.0
第一次去相亲对象家带什么礼物,1.0
第一次去美国带什么礼物给同事,1.0
第一次去美国要带什么礼物,1.0
第一次去美国要带什么礼物好,1.0
第一次去见公婆买什么礼物好,1.0
第一次去见公婆送什么礼物,1.0
第一次和女孩子见面送什么礼物,1.0
第一次收礼物的作文三百字,1.0
第一次给女领导送什么礼物,1.0
第一次见女孩买什么礼物,1.0
第一次见女孩子送什么礼物,1.0
第一次见女孩送什么礼物好,10.0
第一次见女方家长一定要带礼物,1.0
第一次见女方家长买什么礼物,1.0
第一次见女方家长带什么礼物好,1.0
第一次见女方家长带哪些礼物合适,1.0
第一次见女方家长送什么礼物,1.0
第一次见女方父亲送什么礼物好,1.0
第一次见女方父母送什么礼物,1.0
第一次见婆婆买什么礼物,1.0
第一次见婆婆送什么礼物,3.0
第一次见婆婆送什么礼物好,1.0
第一次见家长带什么礼物,5.0
第一次见家长带什么礼物合适,1.0
第一次见家长带什么礼物合适吗,1.0
第一次见家长带什么礼物好,3.0
第一次见家长该买什么礼物,2.0
第一次见家长该买什么礼物好,1.0
第一次见家长送什么礼物好,1.0
第一次见对方父母送什么礼物好,1.0
第一次见父母送什么礼物好,1.0
第一次见男方家长买什么礼物,1.0
第一次见男方家长带什么礼物,2.0
第一次见男方家长带什么礼物好,27.0
第一次见男方父亲送什么礼物,1.0
第一次见男方父母带什么礼物,1.0
第一次见面去什么地方送什么礼物,1.0
第一次见面家长送什么礼物好,1.0
第一次见面送不送礼物,1.0
第一次跟别人介绍的女孩见面可以送礼物吗,1.0
第一次送礼物给女孩子不收,1.0
第一次送给婆婆的礼物排行榜,1.0
红人直播刷礼物兑换钱,1.0
给2周岁女宝过生日送什么礼物,1.0
给yy主播刷礼物视频,1.0
给上小学的小孩送什么礼物,2.0
给做月子的女人适合买什么礼物,1.0
给公司同事买礼物一般买什么,1.0
给公司女领导买什么生日礼物最好,1.0
给哥哥姐姐制作礼物活动反思,2.0
给女领导过生日送什么礼物,6.0
给女领导过生日送什么礼物好,3.0
给日本小学生送什么自制礼物,1.0
给男相亲对象买礼物,1.0
给相亲女孩送礼物他说要怎么还我,1.0
给美国女客户送什么礼物,1.0
美国买什么礼物送母亲,1.0
美国人在中国过生日送什么礼物好,1.0
美国带什么礼物送给小朋友,1.0
美国带什么礼物送长辈,1.0
美国教师不接受学生礼物的原因,1.0
老人过生日小孩送什么礼物,3.0
老人过生日小孩送什么礼物好,2.0
老婆刚生完小孩生日送什么礼物,1.0
老婆接受别的男人的礼物不还要和我离婚,1.0
老板买了礼物给女下属后女变心,1.0
自制礼物盒子包装图片,1.0
节日送员工创意礼物,1.0
英语作文推荐中国礼物,1.0
英语作文美国网友送的礼物,1.0
虎牙主播礼物那里去看,1.0
虎牙免费礼物主播能赚几个钱,1.0
虎牙直播主播pk刷礼物,1.0
虎牙直播平台礼物兑换,1.0
要送闺蜜礼物不知道送什么,1.0
见家长第一次带什么礼物,1.0
见对象家长送什么礼物,1.0
视频儿童折纸礼物盒子,1.0
说说自己送给别人礼物,1.0
说说谢谢你送我的礼物,2.0
请问女儿送给情人做生日礼物,1.0
谢谢你从美国带回来的礼物英文,1.0
谢谢你送的礼物说说,1.0
谢谢别人送的礼物句子,1.0
谢谢女儿送的礼物图片,1.0
谢谢女儿送的礼物英文,2.0
谢谢女儿送的礼物英文怎么说,1.0
谢谢妹妹送的礼物英语,2.0
谢谢妹妹送的礼物英语怎么说,1.0
谢谢礼物的句子英文怎么说,1.0
谢谢送我的礼物英文怎么说,1.0
谢谢送的礼物说说,12.0
谢谢闺蜜送的礼物说说,1.0
贵重的礼物收了又想还,1.0
贺卡贺卡礼物作文100字,1.0
超市里能买到的送老人的生日礼物,1.0
过年去长辈家窜门带什么礼物好,1.0
过年没给父母买礼物,1.0
过年没给父母带礼物,1.0
过年看老人买什么礼物,1.0
过年给女领导送什么礼物,2.0
过年给客户老婆送什么礼物好,1.0
过年给父母买多少钱的礼物,1.0
过年给男领导送什么礼物好,1.0
过年见家长送什么礼物,1.0
过年送婆婆礼物排行榜,1.0
过年送对象妹妹什么礼物,1.0
过年送男领导什么礼物,2.0
过年送长辈什么礼物二百块钱左右,1.0
过年送长辈的礼物推荐,1.0
过年送领导4岁儿子礼物,1.0
过年送领导4岁小孩礼物,1.0
过年送领导7岁小孩礼物,1.0
过年送领导礼物怎么说,1.0
过年适合送领导的礼物,1.0
过年都送父母什么礼物,1.0
过生日情人人不送礼物,1.0
过生日纪念日没礼物收,1.0
