words,lenword_count
14岁儿子生日妈妈送什么礼物好呢,1.0
为妈妈做一份礼物作文,2.0
买礼物送妈妈英语怎么说,1.0
以妈妈的礼物为题作文600字,3.0
儿子结婚妈妈送什么礼物,2.0
儿童送给妈妈的情人礼物,1.0
关于送给妈妈的礼物的英语作文,1.0
写妈妈送我礼物作文,3.0
写我送妈妈礼物作文,2.0
写送给妈妈的礼物作文600字,2.0
去日本送妈妈礼物,2.0
大班过生日教案不要妈妈买礼物,1.0
女儿17岁生日妈妈送啥礼物,1.0
女儿给妈妈送的礼物图片,1.0
女儿过生日妈妈送什么礼物,1.0
女儿送妈妈生日礼物说说,1.0
女儿送妈妈礼物说说,2.0
女孩说妈妈说不能随便收礼物,1.0
女朋友的妈妈过生日送什么礼物好,1.0
妈妈55岁生日送什么礼物实用,1.0
妈妈本命年生日送什么礼物,1.0
妈妈本命年适合送什么礼物,1.0
妈妈爸爸结婚60年送什么礼物,1.0
妈妈生日儿子送什么礼物,2.0
妈妈生日写礼物咋写,1.0
妈妈生日礼物作文英语怎么说,1.0
妈妈生日送什么不用钱的礼物好,1.0
妈妈生日送什么礼物好自己做,1.0
妈妈生日送什么礼物好自己做的,1.0
妈妈生日送什么礼物有意义,1.0
妈妈的母亲节礼物作文400字,2.0
妈妈的礼物400字作文600字,2.0
妈妈的礼物600字贺卡,1.0
妈妈的礼物写篇作文600字,1.0
妈妈的礼物读后感600字作文,1.0
妈妈给予我的礼物作文600字,1.0
妈妈说礼物浪费说说,1.0
妈妈过生日送什么礼物好还花钱少,1.0
妈妈送儿子18岁成人礼物,1.0
妈妈送我的生日的礼物作文,2.0
妈妈送我的礼物600字,2.0
妈妈送给我的礼物初中作文,1.0
宝宝一周岁生日妈妈们送什么礼物,1.0
对象妈妈过生日送什么礼物,1.0
对象的妈妈生日送什么礼物,2.0
小学作文给妈妈买礼物,1.0
小学生作文给妈妈的创意礼物,1.0
小学生作文送给妈妈的生日礼物,1.0
小孩送妈妈的创意礼物,1.0
小班教案送给妈妈的礼物,1.0
小班美术送给妈妈的礼物反思,1.0
小班送给妈妈的礼物折纸,1.0
幼儿园大班送给妈妈的礼物,1.0
情人妈妈过生日送什么礼物,2.0
情人妈妈过生日送什么礼物好,1.0
情人节妈妈送儿子什么礼物,1.0
情人节送妈妈什么礼物图片,1.0
我想送给妈妈一个礼物英语,1.0
我正在为妈妈买礼物用英语怎么说,1.0
我送妈妈礼物作文400字,1.0
梦见别人送妈妈的礼物,1.0
梦见妈妈送我贵重礼物,1.0
母亲节小朋友送妈妈什么礼物好便宜点,1.0
母亲节我给妈妈的礼物作文400字,1.0
母亲节送妈妈礼物作文,2.0
母亲节送妈妈礼物图片,1.0
母亲节送妈妈礼物图片大全,1.0
母亲节送妈妈礼物的作文,2.0
母亲节送给妈妈的礼物作文,1.0
生命妈妈的礼物作文600字,2.0
用妈妈送我特殊的礼物写一篇作文,1.0
画礼物送妈妈幼儿园,1.0
礼物作文大家都爱妈妈,1.0
礼物作文送贺卡给妈妈,1.0
礼物送给好妈妈活动反思,1.0
第一次女人送我妈妈礼物,1.0
结婚了妈妈生日送什么礼物,2.0
结婚了妈妈生日送什么礼物好,1.0
给妈妈买礼物作文400字,1.0
给妈妈母亲节的礼物作文400字,3.0
给妈妈生日的礼物作文400字,2.0
给妈妈的母亲节礼物作文400字,2.0
给妈妈的生日礼物英语作文150字,1.0
给妈妈的礼物400字作文600字,2.0
给妈妈的节日礼物英文怎么说,1.0
英语作文送妈妈的礼物,2.0
见女朋友妈妈送什么礼物,1.0
过年想给妈妈送个礼物送什么好,1.0
送妈妈实用的特别礼物,1.0
送妈妈本命年礼物后的心情,1.0
送妈妈的礼物150字作文,1.0
送妈妈的礼物作文200字,1.0
送妈妈礼物作文400字,3.0
送妈妈礼物心情说说,1.0
送妈妈礼物怎么说英语,1.0
送妈妈礼物怎么说英语怎么说,1.0
送妈妈礼物的英语作文,2.0
送妈妈礼物英文怎么说,1.0
送给妈妈的创意diy礼物,1.0
送给妈妈的春节礼物作文3oo字,1.0
送给妈妈的生日礼物作文150字,1.0
送给妈妈的生日礼物作文400字,1.0
送给妈妈的礼物600字,11.0
送给妈妈的礼物600字作文,10.0
送给妈妈的礼物五年级作文400字,1.0
送给妈妈的礼物作文300字,1.0
送给妈妈的礼物作文400字,4.0
送给妈妈的礼物作文450字,1.0
送给妈妈的礼物作文600字,10.0
送给妈妈的礼物作文小学作文,4.0
送给妈妈的礼物英文怎么说,1.0
送给妈妈的礼物英语怎么说,1.0
送给妈妈的礼物读作文600字,2.0
送给妈妈的礼物贺卡作文,1.0
送给妈妈的节日礼物小学小学五年级作文,1.0
送给妈妈礼物作文100字,1.0
送给妈妈礼物的作文600字,8.0
送给妈妈礼物英语作文,2.0
送给母亲节妈妈的礼物作文,3.0
闺女送妈妈的礼物说说,1.0
阅读妈妈的礼物作文600字,2.0
